{
  "pass_rate": {
    "with_skill": 0.6667,
    "without_skill": 0.0,
    "delta_pts": 66.67
  },
  "duration_ms": {
    "with_skill_avg": 0.0,
    "without_skill_avg": 0.0,
    "delta_pct": null
  },
  "turns": {
    "with_skill_avg": 2.0,
    "without_skill_avg": 4.0,
    "delta_pct": -50.0
  },
  "tokens": {
    "with_skill_avg": 100.0,
    "without_skill_avg": 200.0,
    "delta_pct": -50.0
  },
  "tool_calls": {
    "with_skill_avg": 0.0,
    "without_skill_avg": 0.0,
    "delta_pct": null
  },
  "duration_ms_correctness_gated": {
    "with_skill_avg": 0.0,
    "without_skill_avg": 0.0,
    "delta_pct": null
  },
  "turns_correctness_gated": {
    "with_skill_avg": 0.0,
    "without_skill_avg": 0.0,
    "delta_pct": null
  },
  "tokens_correctness_gated": {
    "with_skill_avg": 0.0,
    "without_skill_avg": 0.0,
    "delta_pct": null
  },
  "tool_calls_correctness_gated": {
    "with_skill_avg": 0.0,
    "without_skill_avg": 0.0,
    "delta_pct": null
  },
  "errors": 0,
  "error_dominated": false,
  "cases_aggregated": 3,
  "cases_correctness_gated": 0,
  "cases_skipped_apples_oranges": 0,
  "total_cases": 3
}
